{
  "$schema": "http://json-schema.org/draft-07/schema#",
  "$id": "https://riyo.me/schemas/open-datasets/launch-site.schema.json",
  "title": "Launch site dataset item",
  "type": "object",
  "required": [
    "id",
    "name",
    "description",
    "category",
    "submission_url",
    "audience",
    "suitable_for",
    "unsuitable_for",
    "requires_account",
    "moderation",
    "cost",
    "backlink_value",
    "tags",
    "sources",
    "last_checked",
    "notes"
  ],
  "additionalProperties": false,
  "properties": {
    "id": { "$ref": "#/definitions/id" },
    "name": { "type": "string", "minLength": 1 },
    "description": { "type": "string", "minLength": 1 },
    "category": { "type": "string", "minLength": 1 },
    "submission_url": { "type": "string", "pattern": "^https?://" },
    "audience": { "type": "string" },
    "suitable_for": { "$ref": "#/definitions/stringList" },
    "unsuitable_for": { "$ref": "#/definitions/stringList" },
    "requires_account": { "$ref": "#/definitions/status" },
    "moderation": { "$ref": "#/definitions/status" },
    "cost": { "$ref": "#/definitions/status" },
    "backlink_value": { "$ref": "#/definitions/status" },
    "tags": { "$ref": "#/definitions/tags" },
    "sources": { "$ref": "#/definitions/sources" },
    "last_checked": { "$ref": "#/definitions/date" },
    "notes": { "type": "string" }
  },
  "definitions": {
    "id": { "type": "string", "pattern": "^[a-z0-9][a-z0-9-]*$" },
    "date": { "type": "string", "pattern": "^\\d{4}-\\d{2}-\\d{2}$" },
    "status": { "type": "string", "enum": ["yes", "no", "partial", "varies", "unknown", "needs_verification"] },
    "tags": { "type": "array", "items": { "type": "string", "minLength": 1 }, "minItems": 1, "uniqueItems": true },
    "stringList": { "type": "array", "items": { "type": "string", "minLength": 1 }, "minItems": 1 },
    "sources": { "type": "array", "items": { "$ref": "#/definitions/source" }, "minItems": 1 },
    "source": {
      "type": "object",
      "required": ["title", "url", "type", "last_checked"],
      "additionalProperties": false,
      "properties": {
        "title": { "type": "string", "minLength": 1 },
        "url": { "type": "string", "pattern": "^https?://" },
        "type": { "type": "string", "enum": ["official", "community", "reference", "unknown"] },
        "last_checked": { "$ref": "#/definitions/date" }
      }
    }
  }
}
