{
  "id": "hacker-news-show",
  "name": "Hacker News Show HN",
  "description": "A Hacker News submission format used to show projects to a technical audience.",
  "category": "launch-site",
  "submission_url": "https://news.ycombinator.com/submit",
  "audience": "Developers, founders, researchers, and technical readers.",
  "suitable_for": ["Technical products", "Open-source tools", "Developer projects"],
  "unsuitable_for": ["Pure marketing pages", "Low-context announcements"],
  "requires_account": "yes",
  "moderation": "varies",
  "cost": "no",
  "backlink_value": "varies",
  "tags": ["community", "technical", "launch"],
  "sources": [
    {
      "title": "Hacker News Guidelines",
      "url": "https://news.ycombinator.com/newsguidelines.html",
      "type": "official",
      "last_checked": "2026-07-05"
    }
  ],
  "last_checked": "2026-07-05",
  "notes": "Initial entry. Community norms and moderation behavior can vary; verify current guidelines before posting."
}
